1 receive texts
Ether / IP / TCP 58.247.22.167:57664 > 10.0.4.8:5000 S
Ether / IP / TCP 10.0.4.8:5000 > 58.247.22.167:57664 SA
Ether / IP / TCP 58.247.22.167:57664 > 10.0.4.8:5000 A / Padding
Ether / IP / TCP 58.247.22.167:57664 > 10.0.4.8:5000 PA / Raw
Ether / IP / TCP 10.0.4.8:5000 > 58.247.22.167:57664 PA / Raw
Ether / IP / TCP 10.0.4.8:5000 > 58.247.22.167:57664 FPA / Raw
Ether / IP / TCP 58.247.22.167:57664 > 10.0.4.8:5000 A / Padding
Ether / IP / TCP 58.247.22.167:57664 > 10.0.4.8:5000 FA / Padding
Ether / IP / TCP 58.247.22.167:57664 > 10.0.4.8:5000 S：这是一个TCP连接的初始数据包，源IP地址为58.247.22.167，源端口为57664，目标IP地址为10.0.4.8，目标端口为5000。标志位（Flags）为S，表示这是一个建立连接的请求数据包。
Ether / IP / TCP 10.0.4.8:5000 > 58.247.22.167:57664 SA：这是对初始请求的响应数据包，源IP地址为10.0.4.8，源端口为5000，目标IP地址为58.247.22.167，目标端口为57664。标志位为SA，表示确认连接请求，并建立连接。
Ether / IP / TCP 58.247.22.167:57664 > 10.0.4.8:5000 A / Padding：这是一个确认连接的数据包，源IP地址为58.247.22.167，源端口为57664，目标IP地址为10.0.4.8，目标端口为5000。标志位为A，表示确认接收到的数据。此数据包中可能包含填充数据（Padding）。
Ether / IP / TCP 58.247.22.167:57664 > 10.0.4.8:5000 PA / Raw：这是一个包含有效载荷数据（Raw）的数据包，源IP地址为58.247.22.167，源端口为57664，目标IP地址为10.0.4.8，目标端口为5000。标志位为PA，表示这是一个包含数据的确认数据包。
Ether / IP / TCP 10.0.4.8:5000 > 58.247.22.167:57664 PA / Raw：这是对第4个数据包的确认响应数据包，源IP地址为10.0.4.8，源端口为5000，目标IP地址为58.247.22.167，目标端口为57664。标志位为PA，表示这是一个包含数据的确认数据包。
Ether / IP / TCP 10.0.4.8:5000 > 58.247.22.167:57664 FPA / Raw：这是一个包含数据和终止连接请求的数据包，源IP地址为10.0.4.8，源端口为5000，目标IP地址为58.247.22.167，目标端口为57664。标志位为FPA，表示终止连接请求，并包含数据。
Ether / IP / TCP 58.247.22.167:57664 > 10.0.4.8:5000 A / Padding：这是一个确认连接终止的数据包，源IP地址为58.247.22.167，源端口为57664，目标IP地址为10.0.4.8，目标端口为5000。标志位为A，表示确认连接已经终止。此数据包中可能包含填充数据（Padding）。
Ether / IP / TCP 58.247.22.167:57664 > 10.0.4.8:5000 FA / Padding：这是一个终止连接的请求数据包，源IP地址为58.247.22.167，源端口为57664，目标IP地址为10.0.4.8，目标端口为5000。标志位为FA，表示终止连接的请求。
通过分析这些数据包的标志位和源/目标IP地址和端口，可以推断出一个TCP连接的建立、数据传输和连接终止的过程。其中，S表示建立连接的请求，SA表示确认连接请求并建立连接，A表示确认收到的数据，PA表示包含数据的确认，FPA表示终止连接请求并包含数据，FA表示终止连接的请求。
2 texts and img
Ether / IP / TCP 58.247.22.167:23030 > 10.0.4.8:5000 S
Ether / IP / TCP 10.0.4.8:5000 > 58.247.22.167:23030 SA
Ether / IP / TCP 58.247.22.167:23031 > 10.0.4.8:5000 S
Ether / IP / TCP 10.0.4.8:5000 > 58.247.22.167:23031 SA
Ether / IP / TCP 58.247.22.167:23030 > 10.0.4.8:5000 A / Padding
Ether / IP / TCP 58.247.22.167:23030 > 10.0.4.8:5000 PA / Raw
Ether / IP / TCP 58.247.22.167:23031 > 10.0.4.8:5000 A / Padding
Ether / IP / TCP 58.247.22.167:23031 > 10.0.4.8:5000 PA / Raw
Ether / IP / TCP 58.247.22.167:23031 > 10.0.4.8:5000 A / Raw
Ether / IP / TCP 58.247.22.167:23031 > 10.0.4.8:5000 A / Raw
Ether / IP / TCP 10.0.4.8:5000 > 58.247.22.167:23031 A
Ether / IP / TCP 58.247.22.167:23031 > 10.0.4.8:5000 A / Raw
Ether / IP / TCP 58.247.22.167:23031 > 10.0.4.8:5000 A / Raw
Ether / IP / TCP 10.0.4.8:5000 > 58.247.22.167:23031 A
Ether / IP / TCP 58.247.22.167:23031 > 10.0.4.8:5000 A / Raw
Ether / IP / TCP 10.0.4.8:5000 > 58.247.22.167:23031 A
Ether / IP / TCP 58.247.22.167:23031 > 10.0.4.8:5000 A / Raw
Ether / IP / TCP 58.247.22.167:23031 > 10.0.4.8:5000 A / Raw
Ether / IP / TCP 58.247.22.167:23031 > 10.0.4.8:5000 A / Raw
Ether / IP / TCP 10.0.4.8:5000 > 58.247.22.167:23031 A
Ether / IP / TCP 58.247.22.167:23031 > 10.0.4.8:5000 A / Raw
Ether / IP / TCP 10.0.4.8:5000 > 58.247.22.167:23031 A
Ether / IP / TCP 58.247.22.167:23031 > 10.0.4.8:5000 A / Raw
Ether / IP / TCP 58.247.22.167:23031 > 10.0.4.8:5000 A / Raw
Ether / IP / TCP 10.0.4.8:5000 > 58.247.22.167:23031 A
Ether / IP / TCP 58.247.22.167:23031 > 10.0.4.8:5000 A / Raw
Ether / IP / TCP 58.247.22.167:23031 > 10.0.4.8:5000 A / Raw
Ether / IP / TCP 10.0.4.8:5000 > 58.247.22.167:23031 A
Ether / IP / TCP 58.247.22.167:23031 > 10.0.4.8:5000 A / Raw
Ether / IP / TCP 58.247.22.167:23031 > 10.0.4.8:5000 A / Raw
Ether / IP / TCP 10.0.4.8:5000 > 58.247.22.167:23031 A
Ether / IP / TCP 58.247.22.167:23031 > 10.0.4.8:5000 A / Raw
Ether / IP / TCP 58.247.22.167:23031 > 10.0.4.8:5000 A / Raw
Ether / IP / TCP 10.0.4.8:5000 > 58.247.22.167:23031 A
Ether / IP / TCP 58.247.22.167:23031 > 10.0.4.8:5000 A / Raw
Ether / IP / TCP 58.247.22.167:23031 > 10.0.4.8:5000 A / Raw
Ether / IP / TCP 10.0.4.8:5000 > 58.247.22.167:23031 A
Ether / IP / TCP 58.247.22.167:23031 > 10.0.4.8:5000 A / Raw
Ether / IP / TCP 10.0.4.8:5000 > 58.247.22.167:23030 PA / Raw
Ether / IP / TCP 10.0.4.8:5000 > 58.247.22.167:23030 FPA / Raw
Ether / IP / TCP 58.247.22.167:23031 > 10.0.4.8:5000 A / Raw
Ether / IP / TCP 10.0.4.8:5000 > 58.247.22.167:23031 A
Ether / IP / TCP 58.247.22.167:23031 > 10.0.4.8:5000 A / Raw
Ether / IP / TCP 58.247.22.167:23031 > 10.0.4.8:5000 A / Raw
Ether / IP / TCP 10.0.4.8:5000 > 58.247.22.167:23031 A
Ether / IP / TCP 58.247.22.167:23031 > 10.0.4.8:5000 A / Raw
Ether / IP / TCP 58.247.22.167:23031 > 10.0.4.8:5000 A / Raw
Ether / IP / TCP 10.0.4.8:5000 > 58.247.22.167:23031 A
Ether / IP / TCP 58.247.22.167:23031 > 10.0.4.8:5000 A / Raw
Ether / IP / TCP 58.247.22.167:23031 > 10.0.4.8:5000 A / Raw
Ether / IP / TCP 10.0.4.8:5000 > 58.247.22.167:23031 A
Ether / IP / TCP 58.247.22.167:23031 > 10.0.4.8:5000 A / Raw
Ether / IP / TCP 58.247.22.167:23031 > 10.0.4.8:5000 A / Raw
Ether / IP / TCP 10.0.4.8:5000 > 58.247.22.167:23031 A
Ether / IP / TCP 58.247.22.167:23031 > 10.0.4.8:5000 A / Raw
Ether / IP / TCP 58.247.22.167:23031 > 10.0.4.8:5000 A / Raw
Ether / IP / TCP 58.247.22.167:23031 > 10.0.4.8:5000 A / Raw
Ether / IP / TCP 58.247.22.167:23031 > 10.0.4.8:5000 A / Raw
Ether / IP / TCP 10.0.4.8:5000 > 58.247.22.167:23031 A
Ether / IP / TCP 58.247.22.167:23031 > 10.0.4.8:5000 A / Raw
Ether / IP / TCP 58.247.22.167:23031 > 10.0.4.8:5000 A / Raw
Ether / IP / TCP 10.0.4.8:5000 > 58.247.22.167:23031 A
Ether / IP / TCP 58.247.22.167:23031 > 10.0.4.8:5000 A / Raw
Ether / IP / TCP 58.247.22.167:23031 > 10.0.4.8:5000 A / Raw
Ether / IP / TCP 10.0.4.8:5000 > 58.247.22.167:23031 A
Ether / IP / TCP 58.247.22.167:23031 > 10.0.4.8:5000 A / Raw
Ether / IP / TCP 58.247.22.167:23031 > 10.0.4.8:5000 A / Raw
Ether / IP / TCP 10.0.4.8:5000 > 58.247.22.167:23031 A
Ether / IP / TCP 58.247.22.167:23031 > 10.0.4.8:5000 A / Raw
Ether / IP / TCP 58.247.22.167:23031 > 10.0.4.8:5000 A / Raw
Ether / IP / TCP 10.0.4.8:5000 > 58.247.22.167:23031 A
Ether / IP / TCP 58.247.22.167:23031 > 10.0.4.8:5000 A / Raw
Ether / IP / TCP 58.247.22.167:23031 > 10.0.4.8:5000 A / Raw
Ether / IP / TCP 10.0.4.8:5000 > 58.247.22.167:23031 A
Ether / IP / TCP 58.247.22.167:23031 > 10.0.4.8:5000 A / Raw
Ether / IP / TCP 58.247.22.167:23031 > 10.0.4.8:5000 A / Raw
Ether / IP / TCP 58.247.22.167:23031 > 10.0.4.8:5000 A / Raw
Ether / IP / TCP 10.0.4.8:5000 > 58.247.22.167:23031 A
Ether / IP / TCP 58.247.22.167:23031 > 10.0.4.8:5000 A / Raw
Ether / IP / TCP 10.0.4.8:5000 > 58.247.22.167:23031 A
Ether / IP / TCP 58.247.22.167:23031 > 10.0.4.8:5000 A / Raw
Ether / IP / TCP 58.247.22.167:23030 > 10.0.4.8:5000 A / Padding
Ether / IP / TCP 58.247.22.167:23030 > 10.0.4.8:5000 FA / Padding
Ether / IP / TCP 10.0.4.8:5000 > 58.247.22.167:23030 A
Ether / IP / TCP 58.247.22.167:23031 > 10.0.4.8:5000 PA / Raw
Ether / IP / TCP 58.247.22.167:23031 > 10.0.4.8:5000 A / Raw
Ether / IP / TCP 58.247.22.167:23031 > 10.0.4.8:5000 A / Raw
Ether / IP / TCP 10.0.4.8:5000 > 58.247.22.167:23031 A
Ether / IP / TCP 58.247.22.167:23031 > 10.0.4.8:5000 A / Raw
Ether / IP / TCP 58.247.22.167:23031 > 10.0.4.8:5000 A / Raw
Ether / IP / TCP 10.0.4.8:5000 > 58.247.22.167:23031 A
Ether / IP / TCP 58.247.22.167:23031 > 10.0.4.8:5000 A / Raw
Ether / IP / TCP 58.247.22.167:23031 > 10.0.4.8:5000 A / Raw
Ether / IP / TCP 10.0.4.8:5000 > 58.247.22.167:23031 A
Ether / IP / TCP 58.247.22.167:23031 > 10.0.4.8:5000 A / Raw
Ether / IP / TCP 58.247.22.167:23031 > 10.0.4.8:5000 A / Raw
Ether / IP / TCP 10.0.4.8:5000 > 58.247.22.167:23031 A
Ether / IP / TCP 58.247.22.167:23031 > 10.0.4.8:5000 A / Raw
Ether / IP / TCP 58.247.22.167:23031 > 10.0.4.8:5000 A / Raw
Ether / IP / TCP 10.0.4.8:5000 > 58.247.22.167:23031 A
Ether / IP / TCP 58.247.22.167:23031 > 10.0.4.8:5000 A / Raw
Ether / IP / TCP 58.247.22.167:23031 > 10.0.4.8:5000 A / Raw
Ether / IP / TCP 10.0.4.8:5000 > 58.247.22.167:23031 A
Ether / IP / TCP 58.247.22.167:23031 > 10.0.4.8:5000 A / Raw
Ether / IP / TCP 58.247.22.167:23031 > 10.0.4.8:5000 A / Raw
Ether / IP / TCP 10.0.4.8:5000 > 58.247.22.167:23031 A
Ether / IP / TCP 58.247.22.167:23031 > 10.0.4.8:5000 A / Raw
Ether / IP / TCP 58.247.22.167:23031 > 10.0.4.8:5000 A / Raw
Ether / IP / TCP 10.0.4.8:5000 > 58.247.22.167:23031 A
Ether / IP / TCP 58.247.22.167:23031 > 10.0.4.8:5000 A / Raw
Ether / IP / TCP 58.247.22.167:23031 > 10.0.4.8:5000 A / Raw
Ether / IP / TCP 10.0.4.8:5000 > 58.247.22.167:23031 A
Ether / IP / TCP 58.247.22.167:23031 > 10.0.4.8:5000 A / Raw
Ether / IP / TCP 58.247.22.167:23031 > 10.0.4.8:5000 A / Raw
Ether / IP / TCP 10.0.4.8:5000 > 58.247.22.167:23031 A
Ether / IP / TCP 58.247.22.167:23031 > 10.0.4.8:5000 A / Raw
Ether / IP / TCP 58.247.22.167:23031 > 10.0.4.8:5000 A / Raw
Ether / IP / TCP 10.0.4.8:5000 > 58.247.22.167:23031 A
Ether / IP / TCP 58.247.22.167:23031 > 10.0.4.8:5000 A / Raw
Ether / IP / TCP 58.247.22.167:23031 > 10.0.4.8:5000 A / Raw
Ether / IP / TCP 58.247.22.167:23031 > 10.0.4.8:5000 A / Raw
Ether / IP / TCP 10.0.4.8:5000 > 58.247.22.167:23031 A
Ether / IP / TCP 58.247.22.167:23031 > 10.0.4.8:5000 A / Raw
Ether / IP / TCP 10.0.4.8:5000 > 58.247.22.167:23031 A
Ether / IP / TCP 58.247.22.167:23031 > 10.0.4.8:5000 A / Raw
Ether / IP / TCP 58.247.22.167:23031 > 10.0.4.8:5000 A / Raw
Ether / IP / TCP 10.0.4.8:5000 > 58.247.22.167:23031 A
Ether / IP / TCP 58.247.22.167:23031 > 10.0.4.8:5000 A / Raw
Ether / IP / TCP 58.247.22.167:23031 > 10.0.4.8:5000 A / Raw
Ether / IP / TCP 10.0.4.8:5000 > 58.247.22.167:23031 A
Ether / IP / TCP 58.247.22.167:23031 > 10.0.4.8:5000 A / Raw
Ether / IP / TCP 58.247.22.167:23031 > 10.0.4.8:5000 A / Raw
Ether / IP / TCP 10.0.4.8:5000 > 58.247.22.167:23031 A
Ether / IP / TCP 58.247.22.167:23031 > 10.0.4.8:5000 A / Raw
Ether / IP / TCP 58.247.22.167:23031 > 10.0.4.8:5000 A / Raw
Ether / IP / TCP 10.0.4.8:5000 > 58.247.22.167:23031 A
Ether / IP / TCP 58.247.22.167:23031 > 10.0.4.8:5000 A / Raw
Ether / IP / TCP 58.247.22.167:23031 > 10.0.4.8:5000 A / Raw
Ether / IP / TCP 10.0.4.8:5000 > 58.247.22.167:23031 A
Ether / IP / TCP 58.247.22.167:23031 > 10.0.4.8:5000 A / Raw
Ether / IP / TCP 58.247.22.167:23031 > 10.0.4.8:5000 A / Raw
Ether / IP / TCP 10.0.4.8:5000 > 58.247.22.167:23031 A
Ether / IP / TCP 58.247.22.167:23031 > 10.0.4.8:5000 A / Raw
Ether / IP / TCP 58.247.22.167:23031 > 10.0.4.8:5000 A / Raw
Ether / IP / TCP 10.0.4.8:5000 > 58.247.22.167:23031 A
Ether / IP / TCP 58.247.22.167:23031 > 10.0.4.8:5000 A / Raw
Ether / IP / TCP 58.247.22.167:23031 > 10.0.4.8:5000 A / Raw
Ether / IP / TCP 10.0.4.8:5000 > 58.247.22.167:23031 A
Ether / IP / TCP 58.247.22.167:23031 > 10.0.4.8:5000 A / Raw
Ether / IP / TCP 58.247.22.167:23031 > 10.0.4.8:5000 A / Raw
Ether / IP / TCP 10.0.4.8:5000 > 58.247.22.167:23031 A
Ether / IP / TCP 58.247.22.167:23031 > 10.0.4.8:5000 A / Raw
Ether / IP / TCP 58.247.22.167:23030 > 10.0.4.8:5000 S：发送方发起与目标IP地址为10.0.4.8、端口为5000的主机建立TCP连接的请求。
Ether / IP / TCP 10.0.4.8:5000 > 58.247.22.167:23030 SA：目标主机响应发送方的连接请求，建立TCP连接。
Ether / IP / TCP 58.247.22.167:23031 > 10.0.4.8:5000 S：发送方发起与目标IP地址为10.0.4.8、端口为5000的主机建立TCP连接的请求。
Ether / IP / TCP 10.0.4.8:5000 > 58.247.22.167:23031 SA：目标主机响应发送方的连接请求，建立TCP连接。
Ether / IP / TCP 58.247.22.167:23030 > 10.0.4.8:5000 A / Padding：发送方发送确认数据包，确认目标主机已收到数据。
Ether / IP / TCP 58.247.22.167:23030 > 10.0.4.8:5000 PA / Raw：发送方发送包含有效载荷数据的数据包。
Ether / IP / TCP 58.247.22.167:23031 > 10.0.4.8:5000 A / Padding：发送方发送确认数据包，确认目标主机已收到据。
Ether / IP / TCP 58.247.22.167:23031 > 10.0.4.8:5000 PA / Raw：发送方发送包含有效载荷数据的数据包。
之后的数据包重复了以上类似的过程，其中发送方发送数据包，目标主机发送确认数据包，直到最后的数据包。
3 get text(前接收）
Ether / IP / TCP 58.247.22.167:48192 > 10.0.4.8:5000 S
Ether / IP / TCP 10.0.4.8:5000 > 58.247.22.167:48192 SA
Ether / IP / TCP 58.247.22.167:48192 > 10.0.4.8:5000 A / Padding
Ether / IP / TCP 58.247.22.167:48192 > 10.0.4.8:5000 PA / Raw
Ether / IP / TCP 10.0.4.8:5000 > 58.247.22.167:48192 PA / Raw
Ether / IP / TCP 10.0.4.8:5000 > 58.247.22.167:48192 FPA / Raw
Ether / IP / TCP 58.247.22.167:48192 > 10.0.4.8:5000 A / Padding
Ether / IP / TCP 58.247.22.167:48192 > 10.0.4.8:5000 FA / Padding
4 get img
Ether / IP / TCP 58.247.22.167:21789 > 10.0.4.8:5000 S
Ether / IP / TCP 10.0.4.8:5000 > 58.247.22.167:21789 SA
Ether / IP / TCP 58.247.22.167:21789 > 10.0.4.8:5000 A / Padding
Ether / IP / TCP 58.247.22.167:21789 > 10.0.4.8:5000 PA / Raw
Ether / IP / TCP 10.0.4.8:5000 > 58.247.22.167:21789 PA / Raw
Ether / IP / TCP 10.0.4.8:5000 > 58.247.22.167:21789 A / Raw
Ether / IP / TCP 10.0.4.8:5000 > 58.247.22.167:21789 A / Raw
Ether / IP / TCP 10.0.4.8:5000 > 58.247.22.167:21789 A / Raw
Ether / IP / TCP 58.247.22.167:21789 > 10.0.4.8:5000 A / Padding
Ether / IP / TCP 10.0.4.8:5000 > 58.247.22.167:21789 A / Raw
Ether / IP / TCP 10.0.4.8:5000 > 58.247.22.167:21789 A / Raw
Ether / IP / TCP 10.0.4.8:5000 > 58.247.22.167:21789 A / Raw
Ether / IP / TCP 10.0.4.8:5000 > 58.247.22.167:21789 A / Raw
Ether / IP / TCP 10.0.4.8:5000 > 58.247.22.167:21789 A / Raw
Ether / IP / TCP 10.0.4.8:5000 > 58.247.22.167:21789 A / Raw
Ether / IP / TCP 10.0.4.8:5000 > 58.247.22.167:21789 A / Raw
Ether / IP / TCP 58.247.22.167:21789 > 10.0.4.8:5000 A / Padding
Ether / IP / TCP 10.0.4.8:5000 > 58.247.22.167:21789 A / Raw
Ether / IP / TCP 10.0.4.8:5000 > 58.247.22.167:21789 A / Raw
Ether / IP / TCP 10.0.4.8:5000 > 58.247.22.167:21789 A / Raw
Ether / IP / TCP 10.0.4.8:5000 > 58.247.22.167:21789 A / Raw
Ether / IP / TCP 10.0.4.8:5000 > 58.247.22.167:21789 A / Raw
Ether / IP / TCP 10.0.4.8:5000 > 58.247.22.167:21789 A / Raw
Ether / IP / TCP 10.0.4.8:5000 > 58.247.22.167:21789 A / Raw
Ether / IP / TCP 10.0.4.8:5000 > 58.247.22.167:21789 A / Raw
Ether / IP / TCP 10.0.4.8:5000 > 58.247.22.167:21789 A / Raw
Ether / IP / TCP 10.0.4.8:5000 > 58.247.22.167:21789 A / Raw
Ether / IP / TCP 10.0.4.8:5000 > 58.247.22.167:21789 A / Raw
Ether / IP / TCP 58.247.22.167:21789 > 10.0.4.8:5000 A / Padding
Ether / IP / TCP 10.0.4.8:5000 > 58.247.22.167:21789 A / Raw
Ether / IP / TCP 10.0.4.8:5000 > 58.247.22.167:21789 A / Raw
Ether / IP / TCP 10.0.4.8:5000 > 58.247.22.167:21789 A / Raw
Ether / IP / TCP 10.0.4.8:5000 > 58.247.22.167:21789 A / Raw
Ether / IP / TCP 10.0.4.8:5000 > 58.247.22.167:21789 A / Raw
Ether / IP / TCP 10.0.4.8:5000 > 58.247.22.167:21789 A / Raw
Ether / IP / TCP 10.0.4.8:5000 > 58.247.22.167:21789 A / Raw
Ether / IP / TCP 10.0.4.8:5000 > 58.247.22.167:21789 A / Raw
Ether / IP / TCP 10.0.4.8:5000 > 58.247.22.167:21789 A / Raw
Ether / IP / TCP 10.0.4.8:5000 > 58.247.22.167:21789 A / Raw
Ether / IP / TCP 10.0.4.8:5000 > 58.247.22.167:21789 A / Raw
Ether / IP / TCP 10.0.4.8:5000 > 58.247.22.167:21789 A / Raw
Ether / IP / TCP 10.0.4.8:5000 > 58.247.22.167:21789 A / Raw
Ether / IP / TCP 10.0.4.8:5000 > 58.247.22.167:21789 A / Raw
Ether / IP / TCP 10.0.4.8:5000 > 58.247.22.167:21789 A / Raw
Ether / IP / TCP 58.247.22.167:21789 > 10.0.4.8:5000 A / Padding
Ether / IP / TCP 10.0.4.8:5000 > 58.247.22.167:21789 A / Raw
Ether / IP / TCP 10.0.4.8:5000 > 58.247.22.167:21789 A / Raw
Ether / IP / TCP 10.0.4.8:5000 > 58.247.22.167:21789 A / Raw
Ether / IP / TCP 10.0.4.8:5000 > 58.247.22.167:21789 A / Raw
Ether / IP / TCP 10.0.4.8:5000 > 58.247.22.167:21789 A / Raw
Ether / IP / TCP 10.0.4.8:5000 > 58.247.22.167:21789 A / Raw
Ether / IP / TCP 10.0.4.8:5000 > 58.247.22.167:21789 A / Raw
Ether / IP / TCP 10.0.4.8:5000 > 58.247.22.167:21789 A / Raw
Ether / IP / TCP 10.0.4.8:5000 > 58.247.22.167:21789 A / Raw
Ether / IP / TCP 10.0.4.8:5000 > 58.247.22.167:21789 A / Raw
Ether / IP / TCP 10.0.4.8:5000 > 58.247.22.167:21789 A / Raw
Ether / IP / TCP 10.0.4.8:5000 > 58.247.22.167:21789 A / Raw
Ether / IP / TCP 10.0.4.8:5000 > 58.247.22.167:21789 A / Raw
Ether / IP / TCP 10.0.4.8:5000 > 58.247.22.167:21789 A / Raw
Ether / IP / TCP 10.0.4.8:5000 > 58.247.22.167:21789 A / Raw
Ether / IP / TCP 10.0.4.8:5000 > 58.247.22.167:21789 A / Raw
Ether / IP / TCP 10.0.4.8:5000 > 58.247.22.167:21789 A / Raw
Ether / IP / TCP 10.0.4.8:5000 > 58.247.22.167:21789 A / Raw
Ether / IP / TCP 10.0.4.8:5000 > 58.247.22.167:21789 A / Raw
Ether / IP / TCP 58.247.22.167:21789 > 10.0.4.8:5000 A / Padding
